{"manifest_version":1,"game_id":"blocks","build_id":"blocks-dev-002","control_protocol":1,"game_protocol":1,"sdk_version":"0.3.0","godot_version":"4.7.2.stable.steam.ed1daf0bf","compatibility_id":"blocks-v2","server_artifact":"blocks-project-v2","transport":"enet","max_players":16,"modes":{"sandbox":{"min_players":1,"max_players":16,"maps":["arena"],"allow_join_in_progress":true}}}
