{"manifest_version":1,"game_id":"shooter","build_id":"shooter-dev-001","control_protocol":1,"game_protocol":1,"sdk_version":"0.5.0","godot_version":"4.7.2.stable.steam.ed1daf0bf","compatibility_id":"shooter-v1","server_artifact":"shooter-project-v1","transport":"enet","max_players":16,"modes":{"ffa":{"min_players":1,"max_players":16,"maps":["depot"],"allow_join_in_progress":true}}}
