{"manifest_version":1,"game_id":"turns","build_id":"turns-dev-002","control_protocol":1,"game_protocol":1,"sdk_version":"0.3.0","godot_version":"4.7.2.stable.steam.ed1daf0bf","compatibility_id":"turns-v2","server_artifact":"turns-project-v2","transport":"enet","max_players":16,"modes":{"sandbox":{"min_players":1,"max_players":16,"maps":["table"],"allow_join_in_progress":true}}}
