{
  "manifest_version": 1,
  "game_id": "minimal_room",
  "build_id": "dev-001",
  "control_protocol": 1,
  "game_protocol": 1,
  "sdk_version": "0.1.0",
  "godot_version": "PIN_EXACT_TESTED_VERSION",
  "compatibility_id": "minimal-dev-001",
  "server_artifact": "minimal-dev-001-linux-x86_64",
  "transport": "enet",
  "max_players": 16,
  "modes": {
    "sandbox": {
      "min_players": 2,
      "max_players": 16,
      "maps": [
        "empty"
      ],
      "allow_join_in_progress": true
    }
  }
}
